title,content,comment number,link
CPR是什么？读完这篇文章你就明白了！,"2021年11月1日，万物云启动ESG——“万物云共同发展计划”，其中有一项就是减少服务空间里的非正常死亡事件。
在公司的突发报事系统里记录的非正常死亡事件中，心梗等原因导致的猝死占有一定比例。这类突发事件本可以通过CPR（心肺复苏术）+AED（自动体外除颤器）得到及时救治，但心肺复苏知识普及率不高。
为响应万物云的号召，万御安防陆续开展了一系列措施……
2022年7月11日16时06分，在贵阳万科大都会花样万御安防团队接到指挥中心通知，一位业主躺在地上，陷入昏厥。
16时07分，万御安防团队赶到事发现场。
第一时间查看业主舌头是否阻塞呼吸，同时疏散围观群众；询问基本情况后，李鹏立即实施心肺复苏(CPR)。此时，业主颤抖地抬起手指向自己喉咙部位。
随后张志祥通过“看、查、判”三步法，基本确定业主是异物卡喉，当即采取“海姆立克急救法”对其进行施救。
同时，陈要帮立即寻找AED设备并清除路障，疏通道路，确保救护车辆顺利、通畅驶入。
万御安防团队及时救援业主
16时18分，业主终于恢复呼吸和意识；
16时25分，救护车到达事发地点。
正是因为万御安防团队熟练掌握的心肺复苏急救和海姆立克急救法，10分钟之内，将业主从猝死边缘拯救了回来。
减少服务空间内非正常死亡
近年来，国务院办公厅、全国人大常委会、国家卫健委先后提出，在城市公共场所应当按照规定配备必要的急救设备、设施将可能通过立法的形式在全国推广。
作为城市空间服务者，万物云给业主提供安全舒心的居住环境的同时，也进一步加强让员工建立安全意识，学习基础紧急救援知识如心肺复苏术等，更好地为客户服务。
2021年11月1日，万物云启动公司ESG——“万物云共同发展计划”，其中有一项就是“减少服务空间内非正常死亡”；
2021年12月1日，万物云万首支CPR（心肺复苏术）宣传片《可可梦境之黄金四分钟》发布，开启了全员学习CPR的序幕。
万物云培养了36名AHA（美国心脏协会）认证急救种子导师，这些种子导师已在各地持续孵化了超过200位内训讲师，并铺开全国面客岗位的CPR技能普及。
截至目前，万物云已有3000多名员工在实操课中掌握了CPR技能，超过15万人次完成了线上理论学习。
万物云陆续在服务的住宅小区和商企项目引入昂贵的急救物资AED（自动体外除颤器），新增近100个小区实现AED零的突破。",添加评论,https://zhuanlan.zhihu.com/p/585751156
心肺复苏cpr的第一个步骤是什么啊？,"月初发生的河南120急救延误事件令大家十分关注，在神通广大的朋友的帮助下，听完了一遍求救女孩的电话录音，在听的过程中深感窒息，听完后更是出离的愤怒，窒息在于接线员对急救原则的无知，愤怒在于接线员对生命垂危的淡漠。
即使她不是一个120接线员，只是一个普通路人，在接到这样的求救电话后也应该感到分秒必争的紧迫感。
即使她没有足够的急救能力也应该尝试向有能力的急救医生求助。
但是电话录音中的接线员却让我感受不到她身上存留的人性，仿佛向她求救的女孩是在和她闲聊，又或者这份工作也只是她消遣时间的一个去处。
在无奈愤怒之余，我不禁思考，除了审核120接线员资质，规范化急救流程这些医院方措施外，在救护车到来之前，我们应该如何进行自救或是对他人进行急救处理，来延长患者的生存时间，为患者获得高级生命支持争取更多时间。
今天，我们就从最简单的心肺复苏开始讲起。例如当我们遇到有人晕倒或溺水，呼吸心跳停止时，及时的心肺复苏是十分必要的。也许很多人不会、甚至不了解心肺复苏，但是电视里的各种花式人工呼吸大家总看过吧，今天就教大家一点“人工呼吸“的正确打开方式。
首先，我们要明确一点，人工呼吸只是心肺复苏（Cardio Pulmonary Resuscitation，简称CPR）中的一个步骤，整个心肺复苏过程是包括胸外按压（circulation），开放气道（airway）和人工呼吸（breathing）的，并不是说咱们和晕倒的ta嘴对嘴，贴一会，人家就会醒过来爱上你，人工呼吸的目的是为了向失去呼吸循环功能的人体输送氧气，而不是去占晕倒者的便宜。
其次，整个过程的顺序应该是CAB的顺序，也就是要优先保证晕倒者的循环先恢复，保证气道畅通无异物，然后再去吹气送氧，所以看到晕倒或溺水的人你也别急着先去嘴对嘴，这一步是在整个流程中的最后一步。而且，CAB这一流程并不是只做一次就可以了，在心肺复苏过程中中常常要重复多次，直至患者醒来或是救护车到来，给予其更高级的心肺功能支持。
但是，并不是所有晕倒或溺水的人都需要心肺复苏，心肺复苏这一急救操作针对的是呼吸循环消失的患者，如果一个人因为脑梗或低血糖晕倒，咱们如果不加判断，上去就要展示“精湛”的心肺复苏技巧，这样做不仅不能帮助身处危险的患者，甚至可能加速他们病情的进展，那这我就不是急救而是害人鲸了。人本来通过对应急救治疗能恢复的，这下直接就被我给按没了，所以说急救是一个系统性的操作，心肺复苏并不是万能灵药，在对应的情况下使用对应的急救操作才能达到救人的目的。
说这么多也不是希望大家在没有充分的医学知识的情况下去救人，而是希望通过科普工作能让更多的人了解急救的原则和知识，让我们的医务人员在施展急救操作时能获得更多的理解和帮助，共同营造一个良好的救助环境，从而挽救更多需要救助的人。",添加评论,https://www.zhihu.com/question/38847393/answer/2553360268
跑者必学的救命术：新式CPR的操作与流程,"weizone：任何人都应该要伸出援手，而现在，我们来了解你能做，且能救人一命的CPR。 什么是CPR？ CPR（cardiopulmonary resuscitation, 心肺复苏）阅读全文",添加评论,https://zhuanlan.zhihu.com/p/50730922
